[
  {
    "edge_id": "hrv_reduced_to_autonomic_regulation_shift",
    "source_node": "reduced_hrv_relative_to_baseline",
    "target_node": "autonomic_regulation_shift",
    "relationship_type": "SUPPORTS",
    "evidence_strength_score": 4,
    "confidence_prior": 0.78,
    "source_ids": [
      "shaffer_ginsberg_2017_hrv_metrics_norms"
    ],
    "domain": "HRV_autonomic_regulation",
    "methodology_basis": "Methodological review of HRV metrics, recording durations, physiological interpretation, and norms.",
    "main_finding_summary": "HRV is a useful non-invasive marker of autonomic regulation when interpreted relative to protocol, context, and personal baseline.",
    "limitations": [
      "Not emotion-specific",
      "Affected by respiration, age, fitness, illness, medication, and device quality",
      "Requires baseline-sensitive interpretation"
    ],
    "context_requirements": [
      "Personal baseline",
      "Recording duration",
      "Respiration/activity context",
      "Medication/illness screening"
    ],
    "forbidden_direct_inference": [
      "reduced_hrv_relative_to_baseline_to_anxiety_diagnosis",
      "reduced_hrv_relative_to_baseline_to_depression_diagnosis"
    ],
    "risk_of_overinterpretation": "medium"
  },
  {
    "edge_id": "low_resting_hrv_to_mental_health_related_autonomic_dysregulation",
    "source_node": "low_resting_hrv",
    "target_node": "mental_health_related_autonomic_dysregulation",
    "relationship_type": "MAY_INDICATE",
    "evidence_strength_score": 5,
    "confidence_prior": 0.62,
    "source_ids": [
      "wang_2025_hrv_mental_disorders_umbrella_review"
    ],
    "domain": "HRV_autonomic_regulation",
    "methodology_basis": "Umbrella review of systematic reviews and pooled analyses of HRV in mental disorders.",
    "main_finding_summary": "Lower HRV is associated with several mental-health-related conditions at group level, but the signal is non-specific and cannot identify a diagnosis.",
    "limitations": [
      "High heterogeneity across disorders and HRV metrics",
      "Population-level association",
      "Not usable as a standalone individual diagnosis"
    ],
    "context_requirements": [
      "Repeated measurements",
      "Functional context",
      "Psychological/subjective data",
      "Exclusion of confounders"
    ],
    "forbidden_direct_inference": [
      "low_resting_hrv_to_any_psychiatric_diagnosis"
    ],
    "risk_of_overinterpretation": "high"
  },
  {
    "edge_id": "persistent_low_hrv_to_depressive_like_pattern_contextual",
    "source_node": "persistent_low_hrv",
    "target_node": "depressive_like_pattern_contextual",
    "relationship_type": "WEAKLY_SUPPORTS",
    "evidence_strength_score": 5,
    "confidence_prior": 0.46,
    "source_ids": [
      "wu_2023_hrv_rest_depression_meta_analysis",
      "wang_2025_hrv_mental_disorders_umbrella_review"
    ],
    "domain": "HRV_autonomic_regulation",
    "methodology_basis": "Meta-analysis and umbrella-review evidence on resting HRV differences in depressed populations.",
    "main_finding_summary": "Persistent low HRV may support a depression-like physiological pattern only when combined with mood, energy, sleep, activity, and longitudinal context.",
    "limitations": [
      "Not diagnostic",
      "Can reflect many physiological states",
      "Confounded by sleep, medication, cardiovascular status, and fitness"
    ],
    "context_requirements": [
      "Low mood report",
      "Reduced activity",
      "Sleep disruption",
      "Longitudinal persistence",
      "Clinical screening if used in care context"
    ],
    "forbidden_direct_inference": [
      "persistent_low_hrv_to_major_depressive_disorder"
    ],
    "risk_of_overinterpretation": "high"
  },
  {
    "edge_id": "increased_eda_to_sympathetic_arousal",
    "source_node": "increased_eda",
    "target_node": "sympathetic_arousal",
    "relationship_type": "SUPPORTS",
    "evidence_strength_score": 4,
    "confidence_prior": 0.74,
    "source_ids": [
      "sosa_2026_beyond_eda_multimodal_sns_arousal"
    ],
    "domain": "EDA_sympathetic_arousal",
    "methodology_basis": "Systematic review of multimodal sympathetic nervous system arousal classification and stress detection.",
    "main_finding_summary": "EDA is a useful anchor signal for sympathetic arousal, but its interpretation improves when combined with other physiological and contextual signals.",
    "limitations": [
      "EDA is not emotion-specific",
      "Sensitive to temperature, movement, skin contact, sweat gland physiology, and cognitive load"
    ],
    "context_requirements": [
      "Motion/contact quality",
      "Temperature context",
      "Activity context",
      "Co-markers such as HRV/PPG/skin temperature"
    ],
    "forbidden_direct_inference": [
      "increased_eda_to_anxiety_diagnosis",
      "increased_eda_to_stress_diagnosis"
    ],
    "risk_of_overinterpretation": "high"
  },
  {
    "edge_id": "wearable_multimodal_features_to_stress_state_prediction",
    "source_node": "wearable_multimodal_features",
    "target_node": "stress_state_prediction",
    "relationship_type": "MAY_INDICATE",
    "evidence_strength_score": 4,
    "confidence_prior": 0.52,
    "source_ids": [
      "vos_2023_wearable_stress_monitoring_systematic_review",
      "sosa_2026_beyond_eda_multimodal_sns_arousal"
    ],
    "domain": "wearable_stress_detection",
    "methodology_basis": "Systematic reviews of wearable stress monitoring and multimodal sympathetic arousal classification.",
    "main_finding_summary": "Multimodal wearable features can support stress-state prediction, but generalization across people, protocols, and contexts remains a major limitation.",
    "limitations": [
      "Generalization problem",
      "Small/heterogeneous datasets",
      "Label noise",
      "Context dependence",
      "Risk of overfitting to protocol-specific stressors"
    ],
    "context_requirements": [
      "Personal baseline",
      "Clear label definition",
      "Activity and environmental context",
      "Model uncertainty reporting"
    ],
    "forbidden_direct_inference": [
      "wearable_multimodal_features_to_clinical_stress_diagnosis"
    ],
    "risk_of_overinterpretation": "high"
  },
  {
    "edge_id": "sleep_loss_to_emotion_regulation_impairment",
    "source_node": "sleep_loss",
    "target_node": "emotion_regulation_impairment",
    "relationship_type": "INCREASES_PROBABILITY_OF",
    "evidence_strength_score": 5,
    "confidence_prior": 0.82,
    "source_ids": [
      "palmer_2024_sleep_loss_emotion_meta_analysis",
      "tomaso_2021_sleep_deprivation_restriction_mood_meta_analyses",
      "vandekerckhove_wang_2017_emotion_regulation_sleep"
    ],
    "domain": "sleep_emotion_regulation",
    "methodology_basis": "Systematic review/meta-analysis plus review evidence on sleep loss, emotion, and emotion regulation.",
    "main_finding_summary": "Sleep loss reliably worsens emotional functioning and should be modeled as a major upstream modulator of emotional regulation capacity.",
    "limitations": [
      "Does not identify a specific emotion or diagnosis",
      "Effects vary by sleep-loss type and individual vulnerability",
      "Bidirectional sleep-emotion effects are possible"
    ],
    "context_requirements": [
      "Sleep duration/quality metrics",
      "Previous-night and multi-night context",
      "Subjective energy/mood",
      "Illness/pain/medication screening"
    ],
    "forbidden_direct_inference": [
      "sleep_loss_to_depression_diagnosis",
      "sleep_loss_to_anxiety_diagnosis"
    ],
    "risk_of_overinterpretation": "medium"
  },
  {
    "edge_id": "sleep_restriction_to_negative_mood_increase",
    "source_node": "sleep_restriction",
    "target_node": "negative_mood_increase",
    "relationship_type": "INCREASES_PROBABILITY_OF",
    "evidence_strength_score": 5,
    "confidence_prior": 0.76,
    "source_ids": [
      "tomaso_2021_sleep_deprivation_restriction_mood_meta_analyses",
      "palmer_2024_sleep_loss_emotion_meta_analysis"
    ],
    "domain": "sleep_mood",
    "methodology_basis": "Meta-analytic evidence on sleep deprivation/restriction effects on mood, emotion, and emotion regulation.",
    "main_finding_summary": "Sleep restriction/deprivation increases vulnerability to negative mood states and reduces positive mood.",
    "limitations": [
      "Mood effects are not diagnosis-specific",
      "Acute and chronic sleep restriction may differ",
      "Population and experimental setting matter"
    ],
    "context_requirements": [
      "Sleep history",
      "Baseline mood",
      "Timing of measurement",
      "Stress/activity context"
    ],
    "forbidden_direct_inference": [
      "sleep_restriction_to_mood_disorder"
    ],
    "risk_of_overinterpretation": "medium"
  },
  {
    "edge_id": "sleep_loss_to_reduced_positive_affect",
    "source_node": "sleep_loss",
    "target_node": "reduced_positive_affect",
    "relationship_type": "INCREASES_PROBABILITY_OF",
    "evidence_strength_score": 5,
    "confidence_prior": 0.78,
    "source_ids": [
      "tomaso_2021_sleep_deprivation_restriction_mood_meta_analyses",
      "palmer_2024_sleep_loss_emotion_meta_analysis"
    ],
    "domain": "sleep_mood",
    "methodology_basis": "Meta-analytic evidence on sleep loss and affective outcomes.",
    "main_finding_summary": "Sleep loss is linked to lower positive affect, making low-energy or low-positive-affect hypotheses more plausible when context agrees.",
    "limitations": [
      "Not specific to depression",
      "Can be mediated by fatigue, illness, pain, or medication",
      "Requires within-person comparison"
    ],
    "context_requirements": [
      "Subjective energy",
      "Sleep duration and fragmentation",
      "Recent illness/pain",
      "Baseline affect"
    ],
    "forbidden_direct_inference": [
      "sleep_loss_to_depression_diagnosis"
    ],
    "risk_of_overinterpretation": "medium"
  },
  {